{
  "trace_id": "trace-01HW3V8XK4Z5Y2J3M7P9Q0R2S6",
  "run_id": "01HW3V8XK4Z5Y2J3M7P9Q0R2S6",
  "query": "What are the eligibility requirements for the Federal Skilled Worker program under Express Entry?",
  "as_of": "2026-02-13",
  "user_id": "user-12345",
  "phases": [
    {
      "phase_id": "phase-retrieval-001",
      "phase_name": "RETRIEVAL",
      "started_at": "2026-02-13T09:15:00.000Z",
      "completed_at": "2026-02-13T09:15:45.000Z",
      "duration_ms": 45000,
      "inputs": {
        "query": "What are the eligibility requirements for the Federal Skilled Worker program under Express Entry?",
        "as_of": "2026-02-13",
        "top_k": 10
      },
      "outputs": {
        "sources_retrieved": 10,
        "tier_a_count": 4,
        "tier_b_count": 3,
        "tier_c_count": 3
      },
      "status": "SUCCESS"
    },
    {
      "phase_id": "phase-routing-001",
      "phase_name": "ROUTING",
      "started_at": "2026-02-13T09:15:45.000Z",
      "completed_at": "2026-02-13T09:15:50.000Z",
      "duration_ms": 5000,
      "inputs": {
        "query": "What are the eligibility requirements for the Federal Skilled Worker program under Express Entry?"
      },
      "outputs": {
        "use_a2aj": false,
        "intent": "ELIGIBILITY_QUESTION"
      },
      "status": "SUCCESS"
    },
    {
      "phase_id": "phase-grounding-001",
      "phase_name": "GROUNDING",
      "started_at": "2026-02-13T09:15:50.000Z",
      "completed_at": "2026-02-13T09:16:10.000Z",
      "duration_ms": 20000,
      "inputs": {
        "sources": 10,
        "query": "What are the eligibility requirements for the Federal Skilled Worker program under Express Entry?"
      },
      "outputs": {
        "citation_map": {
          "P1": "src-001",
          "P2": "src-002",
          "C1": "src-003"
        }
      },
      "status": "SUCCESS"
    },
    {
      "phase_id": "phase-generation-001",
      "phase_name": "GENERATION",
      "started_at": "2026-02-13T09:16:10.000Z",
      "completed_at": "2026-02-13T09:17:30.000Z",
      "duration_ms": 80000,
      "inputs": {
        "prompt_tokens": 2500,
        "sources": 3
      },
      "outputs": {
        "response_tokens": 450,
        "citations_used": ["P1", "P2", "C1"]
      },
      "status": "SUCCESS"
    },
    {
      "phase_id": "phase-validation-001",
      "phase_name": "VALIDATION",
      "started_at": "2026-02-13T09:17:30.000Z",
      "completed_at": "2026-02-13T09:17:45.000Z",
      "duration_ms": 15000,
      "inputs": {
        "claims": 3,
        "assertions": 3
      },
      "outputs": {
        "valid": true,
        "checks_passed": 5,
        "failure_state": "NONE"
      },
      "status": "SUCCESS"
    },
    {
      "phase_id": "phase-response-guard-001",
      "phase_name": "RESPONSE_GUARD",
      "started_at": "2026-02-13T09:17:45.000Z",
      "completed_at": "2026-02-13T09:17:50.000Z",
      "duration_ms": 5000,
      "inputs": {
        "response_text": "The Federal Skilled Worker (FSW) program is one of...",
        "binding_claims": 2
      },
      "outputs": {
        "warnings": [],
        "guard_issues": []
      },
      "status": "SUCCESS"
    }
  ],
  "metadata": {
    "model_version": "llama-3.1-70b-versatile",
    "retrieval_top_k": 10,
    "tier_a_count": 4,
    "tier_b_count": 3,
    "tier_c_count": 3
  },
  "created_at": "2026-02-13T09:15:00.000Z",
  "completed_at": "2026-02-13T09:17:50.000Z"
}
